{
  "$schema": "http://json-schema.org/draft-04/schema#",
  "description": "Tags list",
  "self": {
    "vendor": "com.musimatix",
    "name": "tags_response",
    "format": "jsonschema",
    "version": "1-0-0"
  },
  "type": "object",
  "properties": {
    "object": {
      "type": "string"
    },
    "version": {
      "type": "string"
    },
    "lang":  {
      "type": "string"
    },
    "tags": {
      "type": "array",
      "items": {
        "type": "object",
        "properties": {
          "id": {
            "type": "integer",
            "description": "Tag's id in database"
          },
          "name": {
            "type": "string",
            "description": "Tag's readable name corresponded to current lang property"
          }
        },
        "required": ["id", "name"],
        "additionalProperties": false
      }
    }
  },
  "required": ["object", "tags"],
  "additionalProperties": false
}
